{
 "id": "su_is2",
 "name": "IS-2 (1944)",
 "schema_version": 1,
 "model": "model.glb",
 "meta": {
  "nation": "ussr",
  "class": "heavy",
  "year": 1944,
  "outline": "dimensions",
  "based_on": "IS-2, 1944 production with the straight glacis and 122 mm D-25T",
  "notes": "Built from published dimensions, not from a drawing. Gear ratios are estimates chosen to match the published top speed; turret traverse and elevation rates and the interior layout are estimates."
 },
 "files": {
  "armor": "armor.json",
  "weapons": "weapons.json",
  "engine": "engine.json",
  "crew": "crew.json",
  "modules": "modules.json",
  "visual": "visual.json"
 },
 "hull": {
  "size_m": [
   3.09,
   1.58,
   6.77
  ],
  "mass_kg": 46000,
  "center_of_mass": [
   0,
   0.95,
   0.0
  ]
 },
 "turret": {
  "size_m": [
   2.24,
   0.84,
   3.3
  ],
  "ring_diameter_m": 1.8,
  "position_m": [
   0.0,
   1.58,
   0.75
  ]
 },
 "physics": {
  "track_width_m": 0.65,
  "track_length_m": 4.3,
  "suspension": {
   "kind": "torsion_bar",
   "travel_m": 0.16,
   "stiffness": 420000,
   "damping": 30000
  },
  "rolling_resistance": 0.045,
  "sprocket_radius_m": 0.36,
  "drivetrain_efficiency": 0.8,
  "max_brake_decel_ms2": 5.0,
  "max_turn_rate_deg_s": 20.0,
  "max_reverse_speed_ms": 2.0,
  "min_turn_radius_m": 0.0
 }
}
